date,result ranking,general classification,race name,distance,PCS point,UCI point,year
29.08,22,,Grand Prix de Beuvry-la-Forêt (1.2) ,,,,2005
23.08,11,,Grand Prix de Beuvry-la-Forêt (1.6) ,156,,,2004
17.08,38,,Omloop van de Grensstreek (1.6) ,176,,,2004
11.07,1,,GP de Dourges (1.6) ,,15,,2004
03.04,17,,Les Boucles de l'Artois (1.6) ,173,,,2004
07.03,32,,Grand Prix De La Ville De Lillers Souvenir Bruno Comini (1.5) ,175,,,2004
27.07,7,,Grand Prix de la ville de Pérenchies (1.6) ,162,,,2003
13.07,10,,GP de Dourges (1.6) ,185.4,,,2003
09.03,46,,Grand Prix De La Ville De Lillers Souvenir Bruno Comini (1.5) ,178,,,2003
