date,result ranking,race name,distance
2001-01-16,56,Nationale Sluitingprijs Putte-Kapellen (1.4) ,177.0
2001-03-18,30,Omloop van het Waasland-Kemzeke () ,190.0
2001-01-16,56,Nationale Sluitingprijs Putte-Kapellen (1.4) ,177.0
2001-03-18,30,Omloop van het Waasland-Kemzeke () ,190.0
1999-09-05,42,Grote Prijs Jef Scherens - Leuven (1.4) ,192.0
1999-08-22,15,National Championships Belgium U23 - Road Race (NC) ,157.3
1999-04-25,29,Ronde van Vlaanderen U23 (1.2) ,180.0
1998-04-26,28,Ronde van Vlaanderen U23 (1.2) ,174.0
1997-01-14,17,Nationale Sluitingprijs Putte-Kapellen () ,170.0
